{
  "$schema": "https://json-schema.org/draft/2020-12/schema",
  "$id": "https://kronos.local/schemas/kronos_d0_price_basis_evidence.v1.schema.json",
  "title": "Kronos D0 Price Basis Evidence v1",
  "type": "object",
  "additionalProperties": false,
  "required": ["schema", "statement", "attestations", "status", "blocking_codes"],
  "properties": {
    "schema": {"const": "kronos_d0_price_basis_evidence.v1"},
    "statement": {"$ref": "#/$defs/statement"},
    "attestations": {"$ref": "#/$defs/attestations"},
    "status": {"enum": ["VERIFIED", "BLOCKED"]},
    "blocking_codes": {"type": "array", "items": {"const": "D0_PRICE_BASIS_NOT_VERIFIED"}, "maxItems": 1}
  },
  "allOf": [
    {"if": {"properties": {"status": {"const": "VERIFIED"}}, "required": ["status"]}, "then": {"properties": {"blocking_codes": {"const": []}}}},
    {"if": {"properties": {"status": {"const": "BLOCKED"}}, "required": ["status"]}, "then": {"properties": {"blocking_codes": {"const": ["D0_PRICE_BASIS_NOT_VERIFIED"]}}}}
  ],
  "$defs": {
    "sha256": {"type": "string", "pattern": "^[0-9a-f]{64}$"},
    "uuid": {"type": "string", "pattern": "^[0-9a-f]{8}-[0-9a-f]{4}-[1-5][0-9a-f]{3}-[89ab][0-9a-f]{3}-[0-9a-f]{12}$"},
    "utc": {"type": "string", "pattern": "^\\d{4}-\\d{2}-\\d{2}T\\d{2}:\\d{2}:\\d{2}Z$"},
    "date": {"type": "string", "pattern": "^\\d{4}-\\d{2}-\\d{2}$"},
    "safeInt": {"type": "integer", "minimum": 0, "maximum": 9007199254740991},
    "positiveSafeInt": {"type": "integer", "minimum": 1, "maximum": 9007199254740991},
    "principalUri": {"type": "string", "pattern": "^agent://[^/\\s]+$"},
    "keyId": {"$ref": "#/$defs/uuid"},
    "base64url64": {"type": "string", "pattern": "^[A-Za-z0-9_-]{86}$"},
    "trustedPriceBasisPath": {"type": "string", "pattern": "^_database/evidence/price_basis/(?!.*(?:^|/)\\.\\.(?:/|$))(?!.*//)[A-Za-z0-9._/-]+$"},
    "dateRange": {
      "type": "object",
      "additionalProperties": false,
      "required": ["start", "end"],
      "properties": {"start": {"$ref": "#/$defs/date"}, "end": {"$ref": "#/$defs/date"}}
    },
    "dataset": {
      "type": "object",
      "additionalProperties": false,
      "required": ["artifact_path", "dataset_id", "source_database_sha256", "source_database_byte_length", "date_range", "code_count", "row_count"],
      "properties": {
        "artifact_path": {"$ref": "#/$defs/trustedPriceBasisPath"},
        "dataset_id": {"type": "string", "pattern": "^[A-Za-z0-9][A-Za-z0-9._-]{0,127}$"},
        "source_database_sha256": {"$ref": "#/$defs/sha256"},
        "source_database_byte_length": {"$ref": "#/$defs/positiveSafeInt"},
        "date_range": {"$ref": "#/$defs/dateRange"},
        "code_count": {"$ref": "#/$defs/positiveSafeInt"},
        "row_count": {"$ref": "#/$defs/positiveSafeInt"}
      }
    },
    "rawOhlc": {
      "type": "object",
      "additionalProperties": false,
      "required": ["open", "high", "low", "close"],
      "properties": {"open": {"const": "RAW_OPEN"}, "high": {"const": "RAW_HIGH"}, "low": {"const": "RAW_LOW"}, "close": {"const": "RAW_CLOSE"}}
    },
    "adjustedOhlc": {
      "type": "object",
      "additionalProperties": false,
      "required": ["open", "high", "low", "close"],
      "properties": {"open": {"const": "ADJUSTED_OPEN"}, "high": {"const": "ADJUSTED_HIGH"}, "low": {"const": "ADJUSTED_LOW"}, "close": {"const": "ADJUSTED_CLOSE"}}
    },
    "priceBasis": {
      "oneOf": [
        {"type": "object", "additionalProperties": false, "required": ["basis", "ohlc_semantics"], "properties": {"basis": {"const": "RAW"}, "ohlc_semantics": {"$ref": "#/$defs/rawOhlc"}}},
        {"type": "object", "additionalProperties": false, "required": ["basis", "ohlc_semantics"], "properties": {"basis": {"const": "ADJUSTED"}, "ohlc_semantics": {"$ref": "#/$defs/adjustedOhlc"}}}
      ]
    },
    "equations": {
      "type": "object",
      "additionalProperties": false,
      "required": ["record_count", "verified_collapse"],
      "properties": {
        "record_count": {"const": "record_count == matched_count + missing_count + conflict_count"},
        "verified_collapse": {"const": "missing_count == 0 and conflict_count == 0 implies matched_count == record_count"}
      }
    },
    "corporateActionSource": {
      "type": "object",
      "additionalProperties": false,
      "required": ["source_path", "source_sha256", "date_range", "record_count", "matched_count", "missing_count", "conflict_count"],
      "properties": {
        "source_path": {"$ref": "#/$defs/trustedPriceBasisPath"},
        "source_sha256": {"$ref": "#/$defs/sha256"},
        "date_range": {"$ref": "#/$defs/dateRange"},
        "record_count": {"$ref": "#/$defs/safeInt"},
        "matched_count": {"$ref": "#/$defs/safeInt"},
        "missing_count": {"$ref": "#/$defs/safeInt"},
        "conflict_count": {"$ref": "#/$defs/safeInt"}
      }
    },
    "review": {
      "type": "object",
      "additionalProperties": false,
      "required": ["decision", "reviewed_at", "reason"],
      "properties": {"decision": {"enum": ["APPROVE", "REJECT"]}, "reviewed_at": {"$ref": "#/$defs/utc"}, "reason": {"type": "string", "minLength": 1}}
    },
    "statement": {
      "type": "object",
      "additionalProperties": false,
      "required": ["schema", "evidence_uid", "evidence_kind", "dataset", "price_basis", "equations", "corporate_actions", "review", "conflicts", "issued_at"],
      "properties": {
        "schema": {"const": "kronos_d0_price_basis_evidence_statement.v1"},
        "evidence_uid": {"$ref": "#/$defs/uuid"},
        "evidence_kind": {"enum": ["REAL", "SYNTHETIC_PARSER_ONLY"]},
        "dataset": {"$ref": "#/$defs/dataset"},
        "price_basis": {"$ref": "#/$defs/priceBasis"},
        "equations": {"$ref": "#/$defs/equations"},
        "corporate_actions": {"type": "object", "additionalProperties": false, "required": ["splits", "dividends"], "properties": {"splits": {"$ref": "#/$defs/corporateActionSource"}, "dividends": {"$ref": "#/$defs/corporateActionSource"}}},
        "review": {"$ref": "#/$defs/review"},
        "conflicts": {"type": "array", "items": {"type": "string"}},
        "issued_at": {"$ref": "#/$defs/utc"}
      }
    },
    "attestation": {
      "type": "object",
      "additionalProperties": false,
      "required": ["principal_uri", "role", "key_id", "payload_sha256", "algorithm", "signature_encoding", "signature", "signed_at"],
      "properties": {
        "principal_uri": {"$ref": "#/$defs/principalUri"},
        "role": {"enum": ["D0_ISSUER", "D0_REVIEWER"]},
        "key_id": {"$ref": "#/$defs/keyId"},
        "payload_sha256": {"$ref": "#/$defs/sha256"},
        "algorithm": {"const": "Ed25519"},
        "signature_encoding": {"const": "base64url-no-pad"},
        "signature": {"$ref": "#/$defs/base64url64"},
        "signed_at": {"$ref": "#/$defs/utc"}
      }
    },
    "attestations": {
      "type": "object",
      "additionalProperties": false,
      "required": ["issuer", "reviewer"],
      "properties": {
        "issuer": {"allOf": [{"$ref": "#/$defs/attestation"}, {"properties": {"role": {"const": "D0_ISSUER"}}}]},
        "reviewer": {"allOf": [{"$ref": "#/$defs/attestation"}, {"properties": {"role": {"const": "D0_REVIEWER"}}}]}
      }
    }
  }
}
